{
  "schema_version": 1,
  "publication_status": "metadata_roundup",
  "generated_at": "2026-10-29T06:22:08Z",
  "last_successful_collection": "2026-10-29T06:22:04Z",
  "collection_status": "success",
  "sources_succeeded": 6,
  "sources_total": 6,
  "source_results": [
    {
      "source_id": "nature_aging_events",
      "status": "success",
      "fetched": 0,
      "new": 0
    },
    {
      "source_id": "pubmed_events_vienna",
      "status": "success",
      "fetched": 20,
      "new": 0
    },
    {
      "source_id": "pubmed_events_europe",
      "status": "success",
      "fetched": 11,
      "new": 0
    },
    {
      "source_id": "pubmed_events_us",
      "status": "success",
      "fetched": 4,
      "new": 0
    },
    {
      "source_id": "pubmed_events_asia",
      "status": "success",
      "fetched": 18,
      "new": 0
    },
    {
      "source_id": "pubmed_events_global",
      "status": "success",
      "fetched": 25,
      "new": 0
    }
  ],
  "items": [
    {
      "item_id": "fdbd341cf44c8c0e8a20af0f07c5ce1ef6f3a18c8ae61fedfa2bfc8cd98de5fa",
      "title": "Think BIG, Stay Connected: A Regional Immunology Meeting as a Durable Model for Scientific Community Building.",
      "publisher": "Immunology and cell biology",
      "author": "Stanisic DI",
      "source_url": "https://pubmed.ncbi.nlm.nih.gov/42811617",
      "publication_date": null,
      "publication_date_precision": "unknown",
      "publication_date_raw": "2026 Sep 29",
      "location": "other",
      "location_groups": [],
      "tags": [
        "meeting",
        "needs_review"
      ],
      "summary": null,
      "evidence_notes": null,
      "review_state": "candidate"
    },
    {
      "item_id": "f9e6bd38f3c429c7d5a9c2f3153cbcf3a4ab898518836d1b314fc9ceb62d56e2",
      "title": "The construction of a psychoanalytic genealogy: Ramon Sarró and the meeting with Freud.",
      "publisher": "History of psychology",
      "author": "Lévy Lazcano S",
      "source_url": "https://pubmed.ncbi.nlm.nih.gov/41037447",
      "publication_date": null,
      "publication_date_precision": "month",
      "publication_date_raw": "2025 Aug",
      "location": "vienna",
      "location_groups": [
        "vienna",
        "europe"
      ],
      "tags": [
        "europe",
        "meeting",
        "needs_review",
        "vienna"
      ],
      "summary": null,
      "evidence_notes": null,
      "review_state": "candidate"
    },
    {
      "item_id": "f958dc9aa8c1a6a98a70b8dfb4d996af499a2f31fec481e5f7540854746b9717",
      "title": "Meeting report for the Second International Conference on Unconventional Animal Models of Alzheimer's Disease and Aging (UAMAA 2026).",
      "publisher": "Alzheimer's & dementia (New York, N. Y.)",
      "author": "Alshami J",
      "source_url": "https://pubmed.ncbi.nlm.nih.gov/42388534",
      "publication_date": null,
      "publication_date_precision": "unknown",
      "publication_date_raw": "2026 Jul-Sep",
      "location": "us",
      "location_groups": [
        "us"
      ],
      "tags": [
        "conference",
        "geroscience",
        "meeting",
        "needs_review",
        "us"
      ],
      "summary": null,
      "evidence_notes": null,
      "review_state": "candidate"
    },
    {
      "item_id": "f803363b5182cd48a6ebe2b2a3027c9c94dfd54e341ba54aa56d4803c3184ff2",
      "title": "Insights from the European Society for Medical Oncology (ESMO) Gynaecological Cancers Congress 2025.",
      "publisher": "International journal of gynecological cancer : official journal of the International Gynecological Cancer Society",
      "author": "Leis LV",
      "source_url": "https://pubmed.ncbi.nlm.nih.gov/40857972",
      "publication_date": null,
      "publication_date_precision": "month",
      "publication_date_raw": "2025 Oct",
      "location": "europe",
      "location_groups": [
        "europe"
      ],
      "tags": [
        "congress",
        "europe",
        "needs_review"
      ],
      "summary": null,
      "evidence_notes": null,
      "review_state": "candidate"
    },
    {
      "item_id": "f5a0418cbfcd16faf86f5d45739cbd35594ee853d9ab28ed441f6b3672f22ce7",
      "title": "Unconventional animal models of Alzheimer's disease and aging: key insights from the UAMAA 2026 conference.",
      "publisher": "Lab animal",
      "author": "Garduño BM",
      "source_url": "https://pubmed.ncbi.nlm.nih.gov/42749851",
      "publication_date": null,
      "publication_date_precision": "month",
      "publication_date_raw": "2026 Oct",
      "location": "other",
      "location_groups": [],
      "tags": [
        "conference",
        "geroscience",
        "needs_review"
      ],
      "summary": null,
      "evidence_notes": null,
      "review_state": "candidate"
    },
    {
      "item_id": "f4b297b0f3cbe18132c89091c11fccb4dd2b1877d77af523277bec9bbac9eebd",
      "title": "International workshop report on \"Animal resilience and organismal response to environmental change: insights from basal metazoans\", Tutzing (Germany), 22-25 September 2025.",
      "publisher": "Frontiers in zoology",
      "author": "de Luca KL",
      "source_url": "https://pubmed.ncbi.nlm.nih.gov/41580841",
      "publication_date": null,
      "publication_date_precision": "unknown",
      "publication_date_raw": "2026 Jan 25",
      "location": "europe",
      "location_groups": [
        "europe"
      ],
      "tags": [
        "europe",
        "needs_review",
        "workshop"
      ],
      "summary": null,
      "evidence_notes": null,
      "review_state": "candidate"
    },
    {
      "item_id": "ef3335c707f290c253a64139a55290eeeb9469cb7cc7c6711154a3444a082277",
      "title": "Toward actionable interventions in human aging (12th ARDD meeting, 2025).",
      "publisher": "Aging",
      "author": "Dekan A",
      "source_url": "https://pubmed.ncbi.nlm.nih.gov/41944812",
      "publication_date": null,
      "publication_date_precision": "unknown",
      "publication_date_raw": "2026 Apr 6",
      "location": "europe",
      "location_groups": [
        "europe"
      ],
      "tags": [
        "europe",
        "geroscience",
        "meeting",
        "needs_review"
      ],
      "summary": null,
      "evidence_notes": null,
      "review_state": "candidate"
    },
    {
      "item_id": "eb42b3ff8742f0da6f325afc6e9082963d68ede002f2abd75e18ad6e61be827c",
      "title": "[Expert consensus on risk management and interventions for disability and dementia of the elderly population in the community (2026 edition)].",
      "publisher": "Zhonghua yi xue za zhi",
      "author": "Geriatric Medicine Branch, China Association of Gerontology and Geriatrics",
      "source_url": "https://pubmed.ncbi.nlm.nih.gov/41314700",
      "publication_date": null,
      "publication_date_precision": "unknown",
      "publication_date_raw": "2026 Jan 6",
      "location": "asia",
      "location_groups": [
        "asia"
      ],
      "tags": [
        "asia",
        "consensus",
        "event",
        "needs_review"
      ],
      "summary": null,
      "evidence_notes": null,
      "review_state": "candidate"
    },
    {
      "item_id": "ea157e6daf01cfc79dceebc128be9d1f0c641775df3c16199170cf7700679a17",
      "title": "Expert Consensus on the Management of Obesity in Older Adults (2026 Edition).",
      "publisher": "Aging medicine (Milton (N.S.W))",
      "author": "Pan Q",
      "source_url": "https://pubmed.ncbi.nlm.nih.gov/42689016",
      "publication_date": null,
      "publication_date_precision": "month",
      "publication_date_raw": "2026 Aug",
      "location": "asia",
      "location_groups": [
        "asia"
      ],
      "tags": [
        "asia",
        "consensus",
        "event",
        "geroscience",
        "needs_review",
        "nutrition"
      ],
      "summary": null,
      "evidence_notes": null,
      "review_state": "candidate"
    },
    {
      "item_id": "e6643fcb417d44d6bd95a3c736a2f1aa6830727d29e0f940dffe76d04d45738f",
      "title": "Frailty in Cardiorenal Care: A Geriatric Perspective on the 2026 European Society of Cardiology Guidelines.",
      "publisher": "Cureus",
      "author": "Martynenko A",
      "source_url": "https://pubmed.ncbi.nlm.nih.gov/42713081",
      "publication_date": null,
      "publication_date_precision": "month",
      "publication_date_raw": "2026 Sep",
      "location": "europe",
      "location_groups": [
        "europe"
      ],
      "tags": [
        "consensus",
        "europe",
        "event",
        "geroscience",
        "needs_review"
      ],
      "summary": null,
      "evidence_notes": null,
      "review_state": "candidate"
    },
    {
      "item_id": "d6fd7f8abaeb4e28900346345d4391a501b167f03afaa2e9ea609749822d7f9a",
      "title": "International Society of Urological Pathology Multidisciplinary Expert Consultation Conference on Evaluation of Treatment Effects in Prostate and Bladder Cancer: Working Group 2: The Urinary Bladder.",
      "publisher": "The American journal of surgical pathology",
      "author": "Downes MR",
      "source_url": "https://pubmed.ncbi.nlm.nih.gov/42682094",
      "publication_date": null,
      "publication_date_precision": "unknown",
      "publication_date_raw": "2026 Sep 2",
      "location": "us",
      "location_groups": [
        "us"
      ],
      "tags": [
        "conference",
        "needs_review",
        "us"
      ],
      "summary": null,
      "evidence_notes": null,
      "review_state": "candidate"
    },
    {
      "item_id": "d1b890337a2d3d187b7134db0f7e074e8bd0071c23e61061c6a6c2f11c835511",
      "title": "Special Issue: 5. Internationales Lymphologisches Symposium Die lange Nacht der Lymphologie Wien, Östereich, 21.-23. November 2024- 5th International Lymphology Symposium Long Night of Lymphology Vienna, Austria, November 21st to 23rd, 2024.",